{
  "adapter_id": "openai.gpt-image-2",
  "provider": "openai",
  "endpoint": "/v1/images/edits",
  "model": "gpt-image-2-2026-04-21",
  "input_image_role": "source_photo",
  "prompt": "CREATIVE OBJECTIVE\nRebuild the source scene as a tactile layered-paper illustration without inventing narrative facts.\n\nSOURCE FACTS\n- composition.spatial_relationships: road leads from foreground to mountains [observation]\n- color.dominant: blue-green [observation]\n- scene.type: landscape [inference]\n- mood.tone: quiet [inference]\n\nPRESERVATION CONSTRAINTS\n- composition.spatial_relationships: soft — Keep the main foreground, middle-ground, and background relationship.\n\nTRANSFORMATION CONSTRAINTS\n- material.texture: required — Transform all visible surfaces into layered cut paper.\n- color.palette: required — Compress the source palette into five paper colors.\n\nCOMPOSITION\n- layout: source-structure\n- negative space: simplify-into-paper-planes\n- subject scale: 0.55\n\nVISUAL LANGUAGE\n- color strategy: compressed-source-palette\n- accent color: sun-yellow\n- texture: cut-paper-fibers\n- lighting: shallow-layer-shadows\n- mood: quiet-and-tactile\n- graphic marks: none\n\nOUTPUT\n- aspect ratio: 1:1\n- background: opaque\n\nUNRESOLVED FACTS\n- scene.location: unknown; do not invent (No location evidence is visible.)\n\nADDITIONAL CONSTRAINTS\n- Do not add fictional place names or narrative text.",
  "typography_strategy": "none",
  "size": "1024x1024",
  "quality": "medium",
  "output_format": "png",
  "background": "opaque"
}
